key,0,1
3106,Celestial Tide,Damage dealt and potency of all HP restoration actions are reduced.
3107,Eukrasia,Certain actions are being augmented.
3108,Eukrasian Dosis III,Sustaining damage over time.
3109,Eukrasian Diagnosis,A magicked barrier is nullifying damage.
3110,Haima,A magicked barrier is nullifying damage.
3111,Haimatinon,"Stacks are consumed to restore the <hex:024804F201F403><hex:024904F201F503>Haima<hex:0249020103><hex:0248020103> barrier each time it is absorbed. Grants a healing effect when duration expires, its potency based on the number of remaining stacks."
3112,●ゾーエ,
3113,Toxikon,Damage taken is increased.
3114,●トキシコンII,
3115,Addersting,Able to execute <hex:024804F201F403><hex:024904F201F503>Toxikon II<hex:0249020103><hex:0248020103>.
3116,カルディア,
3117,カルディア[被],
3118,Mesotes,"An area of land has been purified, nullifying damage taken for party members within and afflicting enemies who enter with damage over time."
3119,Mesotes,Negating all damage from enemies not under the effect of <hex:024804F201FA03><hex:024904F201FB03>Lype<hex:0249020103><hex:0248020103>.
3120,Lype,Sustaining damage over time.
3121,Featherbrained,"The incessant chirping of birds scatters your thoughts, preventing you from taking action."
3122,Devouring Dark,Consumed by dark flames. Damage dealt and HP recovery are reduced.
3123,Blessing of Light,Bathed in the light of the Mothercrystal.
3124,Defiance,Enmity is increased.
3125,Swift Sprint,Movement speed is greatly increased.
3126,第一の事象記録,自身が1番目に受けた事象が記録されている状態。
3127,第二の事象記録,自身が2番目に受けた事象が記録されている状態。
3128,第三の事象記録,自身が3番目に受けた事象が記録されている状態。
3129,Damage Up,Damage dealt is increased.
3130,Slashing Resistance Down,Slashing resistance is reduced.
3131,Piercing Resistance Down,Piercing resistance is reduced.
3132,Blunt Resistance Down,Blunt resistance is reduced.
3133,Suppuration,Maximum HP is reduced and damage taken is increased.
3134,Bind,Unable to move.
3135,Light Resistance Down,Light resistance is reduced.
3136,Dark Resistance Down,Dark resistance is reduced.
3137,Repertoire,Able to execute <hex:024804F201F403><hex:024904F201F503>Pitch Perfect<hex:0249020103><hex:0248020103>.
3138,Frontliner's March,Weaponskill cast and recast times are reduced while increasing damage dealt by nearby party members.
3139,Frontline March,Damage dealt is increased.
3140,Frontliner's Forte,Weaponskill cast and recast times are reduced while increasing damage dealt by nearby party members.
3141,Frontline Forte,Damage dealt is increased.
3142,Blast Arrow Ready,Able to execute <hex:024804F201F403><hex:024904F201F503>Blast Arrow<hex:0249020103><hex:0248020103>.
3143,The Warden's Paean,Nullifying status afflictions that can be removed by <hex:024804F201F403><hex:024904F201F503>Purify<hex:0249020103><hex:0248020103>.
3144,Final Fantasia,Weaponskill cast and recast times are reduced. Increasing damage dealt by self and nearby party members while also increasing movement speed and gradually filling the limit gauge.
3145,Heroes' Fantasia,Damage dealt and movement speed is increased. Limit gauge is gradually filling.
3146,英雄のファンタジア［戦］,
3147,英雄のファンタジア［魔］,
3148,Heat,Firearm is generating heat. Becomes <hex:024804F201FA03><hex:024904F201FB03>Overheated<hex:0249020103><hex:0248020103> when 5 stacks are accumulated.
3149,Overheated,Able to execute <hex:024804F201F403><hex:024904F201F503>Heat Blast<hex:0249020103><hex:0248020103>. Movement speed is also increased.
3150,Drill Primed,Able to execute <hex:024804F201F403><hex:024904F201F503>Drill<hex:0249020103><hex:0248020103>.
3151,Bioblaster Primed,Able to execute <hex:024804F201F403><hex:024904F201F503>Bioblaster<hex:0249020103><hex:0248020103>.
3152,Air Anchor Primed,Able to execute <hex:024804F201F403><hex:024904F201F503>Air Anchor<hex:0249020103><hex:0248020103>.
3153,Chain Saw Primed,Able to execute <hex:024804F201F403><hex:024904F201F503>Chain Saw<hex:0249020103><hex:0248020103>.
3154,Chain Saw,Damage taken is increased.
3155,Bishop Active,Operating a bishop autoturret.
3156,Aether Mortar,A magicked barrier is nullifying damage.
3157,Mortared,Damage taken is increased.
3158,Analysis,"Gain an additional effect for the next <hex:024804F201F403><hex:024904F201F503>Drill<hex:0249020103><hex:0248020103>, <hex:024804F201F403><hex:024904F201F503>Bioblaster<hex:0249020103><hex:0248020103>, <hex:024804F201F403><hex:024904F201F503>Air Anchor<hex:0249020103><hex:0248020103>, or <hex:024804F201F403><hex:024904F201F503>Chain Saw<hex:0249020103><hex:0248020103> executed."
3159,Bladecatcher,Sharpening your aim. Will grant the effect <hex:024804F201FA03><hex:024904F201FB03>Flourishing Saber Dance<hex:0249020103><hex:0248020103> when 2 stacks are accumulated.
3160,Flourishing Saber Dance,Able to execute <hex:024804F201F403><hex:024904F201F503>Saber Dance<hex:0249020103><hex:0248020103>.
3161,Starfall Dance,Movement speed is increased.
3162,Honing Dance,Dancing blades are dealing damage over time to nearby enemies and deflecting a portion of damage taken.
3163,Acclaim,Potency of <hex:024804F201F403><hex:024904F201F503>Honing Ovation<hex:0249020103><hex:0248020103> is increased.
3164,Honing Ovation,A magicked barrier is nullifying damage.
3165,Down for the Count,Unable to move or execute actions.
3166,Damage Down,Damage dealt is reduced.
3167,Heavy,Movement speed is reduced.
3168,Six-sided Star,Movement speed is increased.
3169,Polyglot,Able to execute <hex:024804F201F403><hex:024904F201F503>Foul<hex:0249020103><hex:0248020103>.
3170,Fire Resonance,Next weaponskill will deal increased damage.
3171,Earth Resonance,Damage potency and healing potency of <hex:024804F201F403><hex:024904F201F503>Earth's Reply<hex:0249020103><hex:0248020103> are increased based on damage taken and compiled over the duration of this effect.
3172,Pressure Point,Weaponskill or <hex:024804F201F403><hex:024904F201F503>Meteodrive<hex:0249020103><hex:0248020103> damage taken from the monk who applied this effect will trigger an additional damage effect.
3173,Thunderclap,A magicked barrier is nullifying damage.
3174,Meteodrive,Unable to move or execute actions.
3175,メテオドライヴ,
3176,Heavensent,Able to execute <hex:024804F201F403><hex:024904F201F503>Heavens' Thrust<hex:0249020103><hex:0248020103>.
3177,Life of the Dragon,Damage dealt and damage taken are increased.
3178,Firstminds' Focus,Able to execute <hex:024804F201F403><hex:024904F201F503>Wyrmwind Thrust<hex:0249020103><hex:0248020103>.
3179,Horrid Roar,Damage dealt to the dragoon who applied this effect is reduced.
3180,Sky High,"Leaping high into the sky, beyond the reach of enemy attacks."
3181,Sky Shatter,A magicked barrier is nullifying damage.
3182,●ぶんどる：自身,
3183,Mug,Damage taken is increased.
3184,Goka Mekkyaku,Suffering damage over time.
3185,Thrill of Battle,Maximum HP is increased.
3186,Huton,A magicked barrier is nullifying damage. Weaponskill cast and recast times are reduced while movement speed is increased.
3187,Doton,"Foul magicks corrupt the ground, dealing earth damage to any who tread upon it."
3188,Shield Oath,Damage taken is reduced.
3189,Meisui,Regenerating HP over time.
3190,星遁天誅,
3191,Death Link,Grants the ninja who applied this effect <hex:024804F201FA03><hex:024904F201FB03>Unsealed Seiton Tenchu<hex:0249020103><hex:0248020103> if defeated before effect expires.
3192,Unsealed Seiton Tenchu,Able to execute <hex:024804F201F403><hex:024904F201F503>Seiton Tenchu<hex:0249020103><hex:0248020103>.
3193,Sealed Goka Mekkyaku,Unable to execute <hex:024804F201F403><hex:024904F201F503>Goka Mekkyaku<hex:0249020103><hex:0248020103>.
3194,Sealed Hyosho Ranryu,Unable to execute <hex:024804F201F403><hex:024904F201F503>Hyosho Ranryu<hex:0249020103><hex:0248020103>.
3195,Sealed Forked Raiju,Unable to execute <hex:024804F201F403><hex:024904F201F503>Forked Raiju<hex:0249020103><hex:0248020103>.
3196,Sealed Huton,Unable to execute <hex:024804F201F403><hex:024904F201F503>Huton<hex:0249020103><hex:0248020103>.
3197,Sealed Doton,Unable to execute <hex:024804F201F403><hex:024904F201F503>Doton<hex:0249020103><hex:0248020103>.
3198,Sealed Meisui,Unable to execute <hex:024804F201F403><hex:024904F201F503>Meisui<hex:0249020103><hex:0248020103>.
3199,Ogi Namikiri,A magicked barrier is nullifying damage.
3200,Kaeshi: Namikiri,A magicked barrier is nullifying damage.
3201,Kaiten,"<hex:024804F201F403><hex:024904F201F503>Yukikaze<hex:0249020103><hex:0248020103> is upgraded to <hex:024804F201F403><hex:024904F201F503>Hyosetsu<hex:0249020103><hex:0248020103>, <hex:024804F201F403><hex:024904F201F503>Gekko<hex:0249020103><hex:0248020103> is upgraded to <hex:024804F201F403><hex:024904F201F503>Mangetsu<hex:0249020103><hex:0248020103>, and <hex:024804F201F403><hex:024904F201F503>Kasha<hex:0249020103><hex:0248020103> is upgraded to <hex:024804F201F403><hex:024904F201F503>Oka<hex:0249020103><hex:0248020103>."
3202,Kuzushi,Damage taken from the samurai who applied this effect is increased.
3203,Tendo Setsugekka Ready,Able to execute <hex:024804F201F403><hex:024904F201F503>Tendo Setsugekka<hex:0249020103><hex:0248020103>.
3204,Immortal Sacrifice,Potency of <hex:024804F201F403><hex:024904F201F503>Plentiful Harvest<hex:0249020103><hex:0248020103> is increased.
3205,Plentiful Harvest,Limit gauge is gradually filling.
3206,Death Warrant,Damage taken from the reaper who applied this effect is compiled. Triggers additional damage when the effect expires.
3207,Hell's Ingress,Movement speed is increased.
3208,The Unforgotten,Personal experiences are being recorded.
3209,Elusive Jump,Movement speed is increased.
3210,Phalanx,Damage taken is reduced.
3211,Fleeting Raiju Ready,Able to execute <hex:024804F201F403><hex:024904F201F503>Fleeting Raiju<hex:0249020103><hex:0248020103>.
3212,Astral Fire,Able to execute <hex:024804F201F403><hex:024904F201F503>Fire III<hex:0249020103><hex:0248020103>.
3213,Astral Fire II,Able to execute <hex:024804F201F403><hex:024904F201F503>Fire IV<hex:0249020103><hex:0248020103>.
3214,Umbral Ice,Able to execute <hex:024804F201F403><hex:024904F201F503>Blizzard III<hex:0249020103><hex:0248020103>.
3215,Umbral Ice II,Able to execute <hex:024804F201F403><hex:024904F201F503>Blizzard IV<hex:0249020103><hex:0248020103>.
3216,Astral Warmth,Swelling with astral energies.
3217,Umbral Freeze,Swelling with umbral energies.
3218,Burns,Suffering fire damage over time.
3219,Deep Freeze,Frozen solid and unable to execute actions.
3220,Apocatastasis,Damage taken is reduced.
3221,Burst,A magicked barrier is nullifying damage.
3222,Soul Resonance,<hex:024804F201F403><hex:024904F201F503>Fire<hex:0249020103><hex:0248020103> is upgraded to <hex:024804F201F403><hex:024904F201F503>Flare<hex:0249020103><hex:0248020103> and <hex:024804F201F403><hex:024904F201F503>Blizzard<hex:0249020103><hex:0248020103> is upgraded to <hex:024804F201F403><hex:024904F201F503>Freeze<hex:0249020103><hex:0248020103>.
3223,Paradox,Able to cast <hex:024804F201F403><hex:024904F201F503>Paradox<hex:0249020103><hex:0248020103>.
3224,Radiant Aegis,"Damage taken is reduced, and a magicked barrier is nullifying damage."
3225,Slipstream,"A localized windstorm settles on the ground, dealing wind damage to any who step inside."
3226,Slipstream,Movement speed is increased.
3227,Slipping,Suffering wind damage over time.
3228,Dreadwyrm Trance,Able to execute <hex:024804F201F403><hex:024904F201F503>Astral Impulse<hex:0249020103><hex:0248020103> and <hex:024804F201F403><hex:024904F201F503>Deathflare<hex:0249020103><hex:0248020103>.
3229,Firebird Trance,Able to execute <hex:024804F201F403><hex:024904F201F503>Fountain of Fire<hex:0249020103><hex:0248020103> and <hex:024804F201F403><hex:024904F201F503>Brand of Purgatory<hex:0249020103><hex:0248020103>.
3230,Everlasting Flight,Regenerating HP over time. Additional HP will be restored automatically upon falling below a certain level or expiration of effect duration.
3231,Scarlet Flame,Sustaining damage over time.
3232,Revelation,Damage dealt is reduced.
3233,Vermilion Radiance,Able to execute <hex:024804F201F403><hex:024904F201F503>Verholy<hex:0249020103><hex:0248020103> and <hex:024804F201F403><hex:024904F201F503>Verflare<hex:0249020103><hex:0248020103>.
3234,Enchanted Riposte,A magicked barrier is nullifying damage.
3235,Enchanted Zwerchhau,A magicked barrier is nullifying damage.
3236,Enchanted Redoublement,A magicked barrier is nullifying damage.
3237,Enchanted Riposte,Suffering damage over time.
3238,Enchanted Zwerchhau,Suffering damage over time.
3239,Enchanted Redoublement,Suffering damage over time.
3240,Magick Barrier,Damage taken is reduced while HP recovered via healing actions is increased.
3241,Frazzle,Damage taken is increased while HP recovered via healing actions is reduced.
3242,Monomachy,Damage taken from the red mage who applied this effect is increased while damage dealt to said red mage is reduced.
3243,Displacement,Damage and cure potency of next spell cast is increased.
3244,●デプラスマン実行可,
3245,White Shift,Augments certain actions with beneficial effects.
3246,Black Shift,Augments certain actions with detrimental effects.
3247,●ポーション,
3248,Resilience,"Nullifying status afflictions that can be removed by <hex:024804F201F403><hex:024904F201F503>Purify<hex:0249020103><hex:0248020103>, as well as knockback and draw-in effects."
3249,Fetters,Unable to execute actions.
3250,Blade of Faith Ready,Able to execute <hex:024804F201F403><hex:024904F201F503>Blade of Faith<hex:0249020103><hex:0248020103>.
3251,,
3252,ナルザルの天秤：死,ナルザルの天秤のうち、死の側に魂が計上されている状態。
3253,ナルザルの天秤：生,ナルザルの天秤のうち、生の側に魂が計上されている状態。
3254,Trick Attack,Damage taken from the ninja who applied this effect is increased.
3255,Undead Rebirth,Most attacks cannot reduce your HP to less than 1.
3256,Orogeny,Damage dealt is reduced.
3257,Berserk,Damage dealt by certain weaponskills is increased.
3258,Lance Charge,Damage dealt by certain weaponskills is increased.
3259,Life Surge,Certain weaponskills are guaranteed to deal critical damage with a portion of the resulting damage being absorbed as HP.
3260,Damage Up,Damage dealt is increased.
3261,Concentrated Poison,"Powerful poison is slowly draining HP, while HP recovery via healing magic is reduced."
3262,Liftoff,Cast into the air.
3263,Wyrmclaw,Shredded by draconic talons. KO will occur when countdown reaches 0.
3264,Wyrmfang,Torn by draconic teeth. KO will occur when countdown reaches 0.
3265,Blood of the Dragon,Drawing upon the unique power of the Azure Dragoon.
3266,Burns,Sustaining fire damage over time.
3267,Burns,Sustaining fire damage over time.
3268,First Brand,Branded with a cryptic spark that will grow into the <hex:024804F201FA03><hex:024904F201FB03>First Flame<hex:0249020103><hex:0248020103> when this effect expires.
3269,Second Brand,Branded with a cryptic spark that will grow into the <hex:024804F201FA03><hex:024904F201FB03>Second Flame<hex:0249020103><hex:0248020103> when this effect expires.
3270,Third Brand,Branded with a cryptic spark that will grow into the <hex:024804F201FA03><hex:024904F201FB03>Third Flame<hex:0249020103><hex:0248020103> when this effect expires.
3271,Fourth Brand,Branded with a cryptic spark that will grow into the <hex:024804F201FA03><hex:024904F201FB03>Fourth Flame<hex:0249020103><hex:0248020103> when this effect expires.
3272,First Flame,Imbued with a cryptic flame that will erupt when this effect expires. Curse can be removed by touching the appropriate infern brand.
3273,Second Flame,Imbued with a cryptic flame that will erupt when this effect expires. Curse can be removed by touching the appropriate infern brand.
3274,Third Flame,Imbued with a cryptic flame that will erupt when this effect expires. Curse can be removed by touching the appropriate infern brand.
3275,Fourth Flame,Imbued with a cryptic flame that will erupt when this effect expires. Curse can be removed by touching the appropriate infern brand.
3276,Call of the Portal,Cursed to take heavy damage when this effect expires. Passing through a portal will remove the curse.
3277,Rite of Passage,Cursed to travel in specified direction. <hex:024804F201FA03><hex:024904F201FB03>Stun<hex:0249020103><hex:0248020103> followed by forced teleportation will occur when this effect expires.
3278,Forbidden Passage,Cannot travel via portal.
3279,Forbidden Passage,Cannot travel via portal.
3280,Blessing of Blight,Archfiendish power is enhancing voidsent's capabilities and regenerative capacity.
3281,Warding Scale,"Under Vrtra's protective auspices, reducing damage taken and restoring HP over time."
3282,Brain Rot,Afflicted with an accursed blight. A stack of 3 will result in zombification.
3283,Fetters,Unable to move.
3284,Tangled,"Ensnared by Barbariccia's hair, reducing movement speed and resulting in damage over time. Attempts to pull away from the tangle will result in being dragged back in, inflicting damage over time."
3285,Awareness,Damage taken is reduced.
3286,Frozen,Ice has begun forming on gear. A stack of 4 will result in <hex:024804F201FA03><hex:024904F201FB03>Deep Freeze<hex:024804F201FA03><hex:024904F201FB03>.
3287,Deep Freeze,"Your body is encased in ice, preventing action and dealing damage over time."
3288,Sustained Damage,Sustaining damage over time.
3289,Fusefield,Deploying an infernal field.
3290,Echo of the Fallen,"The <hex:024804F201F403><hex:024904F201F503>Curse of the Fallen<hex:0249020103><hex:0248020103> resonates within, causing an explosion when this effect expires."
3291,Scream of the Fallen,"The <hex:024804F201F403><hex:024904F201F503>Curse of the Fallen<hex:0249020103><hex:0248020103> resonates within, causing an expansive explosion when this effect expires."
3292,Lingering Echoes,"The <hex:024804F201F403><hex:024904F201F503>Curse of the Fallen<hex:0249020103><hex:0248020103> resonates within, causing a chain of explosions at current position when this effect expires."
3293,Thunderous Echo,"The <hex:024804F201F403><hex:024904F201F503>Curse of the Fallen<hex:0249020103><hex:0248020103> resonates within, causing an intense explosion when this effect expires."
3294,Chains of Resentment,"Bound by hateful chains, causing damage over time."
3295,Gilded Fate,Cursed to perish when this effect expires. Curse can be cleansed by silver flames.
3296,Silvered Fate,Cursed to perish when this effect expires. Curse can be cleansed by golden flames.
3297,Bracing Suds,Awash in wind-aspected soap suds.
3298,Chilling Suds,Awash in ice-aspected soap suds.
3299,Fizzling Suds,Awash in lightning-aspected soap suds.
3300,Medica II of the Seventh Dawn,Regenerating HP over time.
3301,Excellence,Impervious to most attacks.
3302,Warding Scale,Impervious to most attacks.
3303,Supernal Guard,Damage taken is reduced.
3304,Damage Down,Damage dealt is reduced.
3305,Bracing Suds,Awash in wind-aspected soap suds.
3306,Chilling Suds,Awash in ice-aspected soap suds.
3307,Fizzling Suds,Awash in lightning-aspected soap suds.
3308,Inviolate Winds,Ensnared by wind magicks that will be unleashed in the surrounding area when this effect expires.
3309,Holy Bonds,Ensnared by light magicks that will be unleashed in the surrounding area when this effect expires.
3310,Purgatory Winds,"Ensnared by punishing wind magicks that will be unleashed in the surrounding area when this effect expires, and leave a timed sigil in their wake."
3311,Holy Purgation,"Ensnared by punishing wind magicks that will be unleashed in the surrounding area when this effect expires, and leave a timed sigil in their wake."
3312,Overload,Unleashing power beyond physical limitations and taking damage over time.
3313,Aetherial Exchange,Warping the nature of the next action to be executed.
3314,Glossomorph,"Host to a glossal parasite, which will take control of body once this effect expires."
3315,Chelomorph,"Host to a chelic parasite, which will take control of body once this effect expires."
3316,Out of Control,No longer in control of actions due to parasitic influence.
3317,Consumption,Being devoured by pathogens. Will become a glossomorph should this process continue.
3318,Bodily Manipulation,Host movement subject to complete control by resident parasite.
3319,Glossal Resistance Down,Resistance to attacks by glossal parasites is reduced.
3320,Chelic Resistance Down,Resistance to attacks by chelic parasites is reduced.
3321,Aetheronecrosis,"Infected with aetherially activated cells, which will burst explosively when this effect expires."
3322,Glossomorph,"Host to a glossal parasite, which will take control of body once this effect expires."
3323,Dark Resistance Down II,Dark resistance is significantly reduced.
3324,Fetters,Unable to execute actions.
3325,Conceptual Mastery,Primed with powerful magicks.
3326,Blood of the Gorgon,Cursed to unleash poison in the surrounding area when this effect expires.
3327,Breath of the Gorgon,Cursed to unleash poison in the surrounding area when this effect expires.
3328,Spring Tide,A greater cursed tide will be upon you when this effect expires.
3329,Neap Tide,A lesser cursed tide will be upon you when this effect expires.
3330,Imperfection: Alpha,"Imbued with a concept incompatible with this form, which will cause an explosive reaction and influence self and nearby concepts when this effect expires."
3331,Imperfection: Beta,"Imbued with a concept incompatible with this form, which will cause an explosive reaction and influence self and nearby concepts when this effect expires."
3332,Imperfection: Gamma,"Imbued with a concept incompatible with this form, which will cause an explosive reaction and influence self and nearby concepts when this effect expires."
3333,Perfection: Alpha,The perfect vessel for a perfect concept. Drawing near to other perfect concepts will result in mutual influence.
3334,Perfection: Beta,The perfect vessel for a perfect concept. Drawing near to other perfect concepts will result in mutual influence.
3335,Perfection: Gamma,The perfect vessel for a perfect concept. Drawing near to other perfect concepts will result in mutual influence.
3336,Inconceivable,Unable to draw upon perfect concepts until this effect expires.
3337,Winged Conception,Realizing an airborne concept. Resistance to certain wind magicks is increased until this effect expires.
3338,Aquatic Conception,Realizing an aquatic concept. Resistance to certain water magicks is increased until this effect expires.
3339,Shocking Conception,Realizing a levin-wielding concept. Resistance to certain lightning magicks is increased until this effect expires.
3340,Fiery Conception,"Realizing a burning concept, causing damage over time until this effect expires."
3341,Toxic Conception,"Realizing a poisonous concept, causing damage over time until this effect expires."
3342,Growing Conception,"Realizing a plantlike concept, causing damage over time until this effect expires."
3343,Immortal Spark,"Conceiving of the Phoenix in part. Together, four such sparks will give birth to a legendary bird."
3344,Immortal Conception,Realizing a Phoenix concept.
3345,Solosplice,"Self-concept is being warped beyond recognition, resulting in an adverse reaction determined by nearby influences when this effect expires."
3346,Multisplice,"Self-concept is being warped beyond recognition, resulting in an adverse reaction determined by nearby influences when this effect expires."
3347,Supersplice,"Self-concept is being warped beyond recognition, resulting in an adverse reaction determined by nearby influences when this effect expires."
3348,Targeting,Target of incoming attack. Will be bound when this effect expires.
3349,Inverse Magicks,The order of forcible magicks to be cast is inverted.
3350,Soul Stranded,Physical and spiritual forms have been separated.
3351,Eye of the Gorgon,Cursed to unleash a petrifying attack in the direction of gaze when this effect expires.
3352,Crown of the Gorgon,Cursed to unleash a petrifying light upon those nearby when this effect expires.
3353,,
3354,,
3355,,
3356,,
3357,,
3358,Enmity Up,Enmity generation is increased.
3359,Sustained Damage,Sustaining damage over time.
3360,Vulnerability Down,Damage taken is reduced.
3361,Vulnerability Up,Damage taken is increased.
3362,Out of Control,No longer in control of actions due to parasitic influence.
3363,Seduced,Enthralled by an irresistible force and unable to act of your own volition.
3364,Doom,Certain death when counter reaches zero.
3365,Holosakos,A magicked barrier is nullifying damage.
3366,Vulnerability Up,Damage taken is increased.
3367,Rehabilitation,Regenerating HP over time.
3368,Powerful,"Damage dealt is significantly increased, while damage taken is significantly decreased."
3369,,
3370,,
3371,,
3372,Earth Resistance Down II,Earth resistance is significantly reduced.
3373,,
3374,,
3375,,
3376,,
3377,,
3378,,
3379,,
3380,Resurrection Restricted,Resurrection by certain means is impossible.
3381,Astral Fire III,Able to execute <hex:024804F201F403><hex:024904F201F503>High Fire II<hex:0249020103><hex:0248020103>.
3382,Umbral Ice III,Able to execute <hex:024804F201F403><hex:024904F201F503>High Blizzard II<hex:0249020103><hex:0248020103>.
3383,Arcane Triumph,Fated by the Spinner to emerge victorious when this effect expires.
3384,Arcane Triumph,Fated by the Spinner to emerge victorious when this effect expires.
3385,Arcane Attraction,Fated by the Spinner to be <hex:024804F201FA03><hex:024904F201FB03>Seduced<hex:0249020103><hex:0248020103> if gazing at Nymeia when this effect expires.
3386,Attraction Reversed,Fated by the Spinner to be <hex:024804F201FA03><hex:024904F201FB03>Seduced<hex:0249020103><hex:0248020103> if looking away from Nymeia when this effect expires.
