key,0,1
1336,Synastry,"An aetheric bond is created with a party member. Each time a single-target healing spell is cast, that member will recover partial HP."
1337,Synastry,"An aetheric bond is created with a party astrologian. Each time a single-target healing spell is cast by the astrologian, you will recover partial HP."
1338,The Balance,Damage dealt is increased.
1339,The Bole,Damage taken is reduced.
1340,The Ewer,Restoring MP over time.
1341,The Spire,Limit gauge is gradually filling.
1342,Sprint,Movement speed is increased.
1343,Stun,Unable to execute actions.
1344,Heavy,Movement speed is reduced.
1345,Bind,Unable to move.
1346,Slow,Weaponskill and spell cast time and recast time are increased.
1347,Silence,A stifling magic is preventing the use of any actions.
1348,Sleep,Overwhelming drowsiness is preventing the execution of actions.
1349,Stun Resistance,Immune to stun effects.
1350,Heavy Resistance,Immune to heavy effects.
1351,Bind Resistance,Immune to bind effects.
1352,Slow Resistance,Immune to slow effects.
1353,Silence Resistance,Immune to silence effects.
1354,Sleep Resistance,Immune to sleep effects.
1355,Knockback Penalty,Immune to knockback and draw-in effects.
1356,Imp,Transformed into an imp and only able to execute the action Imp Punch.
1357,Gravity Flip,"Gravity is inverted, slowly lifting you further from the ground."
1358,Elevated,Bound to current elevation.
1359,Gradual Petrification,Flesh once soft is slowly turning to stone.
1360,Unstable Gravity,"The gravity about you is highly unstable and will soon rupture, dealing unaspected damage to all allies within range."
1361,Magitek Levitation,"Floating several ilms off the ground, defying the universal laws of gravity."
1362,Divine Veil,A holy barrier is nullifying damage.
1363,Sleep,Overwhelming drowsiness is preventing the execution of actions.
1364,Riddle of Wind,Able to execute <hex:024804F201F403><hex:024904F201F503>Riddle of Wind<hex:0249020103><hex:0248020103>.
1365,Thundercloud,Able to cast <hex:024804F201F403><hex:024904F201F503>Thunder III<hex:0249020103><hex:0248020103> or <hex:024804F201F403><hex:024904F201F503>Thunder IV<hex:0249020103><hex:0248020103>.
1366,Levitation,"Floating several ilms off the ground, defying the universal laws of gravity."
1367,Impactful,Able to execute Impact.
1368,Requiescat,Potency of certain actions is increased and spells require no time to cast.
1369,Requiescat,Spells require no time to cast and consume no MP.
1370,Rage of Halone,Damage dealt and potency of all HP restoration actions are reduced.
1371,Butcher's Block,Damage taken is increased.
1372,Power Slash,HP recovery is reduced.
1373,Immaterialized,Not yet fully materialized to a complete form.
1374,Target Right,Focusing attack on target to the right.
1375,Target Left,Focusing attack on target to the left.
1376,Kyoshin,"Body is enlarged, increasing damage dealt."
1377,Life Drain,"Life force is being drained, causing damage over time."
1378,Dualcast,The next spell will be cast immediately.
1379,Almagest,Celestial magicks are causing damage over time.
1380,White Wound,Taking extra damage from White Antilight.
1381,Black Wound,Taking extra damage from Black Antilight.
1382,Beyond Death,Only beyond death's boundaries can life be achieved.
1383,HP Penalty,Maximum HP is reduced.
1384,Acceleration Bomb,An acceleration-trigger explosive is affixed to the body. Any movement when effect wears off will result in detonation.
1385,Off-balance,Attacks suffered will result in knockback.
1386,Sludge,Sustaining earth damage over time.
1387,Altered States,Action area of effect has been altered.
1388,Ashen,Covered in stygian ash.
1389,Seduced,Enthralled by an irresistible force and unable to act of your own volition.
1390,Levitation,"Floating several ilms off the ground, defying the universal laws of gravity."
1391,Fetters,Unable to execute actions.
1392,Shining Moonstone,"Empowered by the light of the moonstone, increasing damage dealt while reducing damage taken."
1393,Dualcast,The next spell will be cast immediately.
1394,Limp,Your mount has been lamed by an attack. Movement speed is reduced.
1395,Shield Oath,Damage dealt and taken are reduced.
1396,Defiance,Damage dealt and taken are reduced.
1397,Grit,Damage dealt and taken are reduced.
1398,Inner Beast,Damage taken is reduced.
1399,Fetters,Unable to execute actions.
1400,Terror,Frozen with fear and unable to execute actions.
1401,Enervation,Damage dealt is reduced and damage taken is increased.
1402,Vulnerability Up,Damage taken is increased.
1403,Lightspeed,Spell casting time and MP cost are reduced by 100% and 50% respectively.
1404,Divine Benison,A holy blessing from the gods is nullifying damage.
1405,Disabled,Damage dealt is reduced.
1406,Chain Stratagem,Damage taken is increased.
1407,Barrage,Striking multiple times per weaponskill.
1408,Cometeor,Damage taken is increased.
1409,Terminal Velocity,HP recovery is reduced.
1410,Chanchala,Lakshmi's divine nature vacillates unsteadily.
1411,Preferred World Bonus,Experience earned while below level <hex:022003E96C03> is dramatically increased.
1412,Vulnerability Up,Damage taken is increased.
1413,Riddle of Fire,Damage dealt is increased.
1414,Battle Litany,Damage dealt is increased.
1415,Protect,Damage taken is reduced.
1416,Grounded,Bound to current elevation.
1417,Stone Curse,Turned into stone. Taking damage results in instant death.
1418,Abandonment,Will suffer <hex:024804F201FA03><hex:024904F201FB03>Fear<hex:0249020103><hex:0248020103> when straying too far from party members.
1419,The Worm's Curse,"HP regeneration is nullified and damage is taken slowly over time. Attacking, however, will periodically restore HP."
1420,Mounted,Mounted in warmachina. HP recovery and beneficial effects conferred by actions are nullified.
1421,Craven,"Courage is fully tapped, increasing damage taken."
1422,Temporary Misdirection,Overcome with temporary insanity. Can only move in the direction indicated.
1423,Transfiguration,Spiritual and corporeal forms are drastically altered.
1424,Divine Commandment: Flee,Affected by the word of a god.
1425,Divine Commandment: Turn,Affected by the word of a god.
1426,Unnerved,"Courage is tapped, increasing damage taken."
1427,Drenched,Body is covered in water and susceptible to freezing.
1428,削除予定,削除予定
1429,Breathless,Toxins in the water are causing difficulty breathing. A stack of 10 will result in KO.
1430,Legendary Resolve,"Convinced of your mettle, Shinryu has unleashed its true power."
1431,Tower Defense,"The tower's field invigorates those who enter its sphere of influence, halving damage taken and regenerating HP over time."
1432,Tower Defense,The tower's protective field is active.
1433,Transfiguration,Corporeal form is altered.
1434,Mana Hypersensitivity,Additional damage taken from <hex:024804F201F403><hex:024904F201F503>Hatch<hex:0249020103><hex:0248020103>.
1435,Piercing Resistance Down II,Piercing resistance is significantly reduced.
1436,Phoenix's Blessing,Damage dealt is increased.
1437,Lohs Daih,Bahamut Prime's insanity has peaked. Damage dealt is increased.
1438,Resonant,Strength is transcending that of mere mortals.
1439,Independent Tactics,Maximum HP and damage dealt are increased while damage taken is reduced.
1440,Offensive Tactics,Damage dealt is increased.
1441,Defensive Tactics,Maximum HP is increased while damage taken is reduced.
1442,Balanced Tactics,Maximum HP and damage dealt are increased.
1443,Clockwork,"When the gears run down, functionality will cease. HP restoration is reduced."
1444,Magitek Field,Impervious to all damage.
1445,The Deceiver,Wearing the face of the god of lies.
1446,The Upholder,Wearing the face of the god of truth.
1447,Elemental EXP Up,Elemental EXP earned through battle while at an elemental level lower than 50 is increased.
1448,Transfiguration,Corporeal form has been altered.
1449,Troubadour's Minuet,Damage dealt is increased.
1450,Troubadour's Paeon,Weaponskill and spell cast and recast time are reduced.
1451,Lord of Crowns,Damage taken is increased.
1452,Lady of Crowns,Damage taken is reduced.
1453,Right Eye,Damage dealt is increased.
1454,Left Eye,Damage dealt is increased.
1455,Flamethrower,"Emitting a gout of searing flames in a cone, dealing damage over time."
1456,Thrill of War,Refreshing HP of party members within range while draining own MP.
1457,Shake It Off,A highly effective defensive maneuver is nullifying damage.
1458,Flamethrower Flames,Taking damage over time.
1459,Transfiguration,Spiritual and corporeal forms are drastically altered.
1460,Fetters,Unable to execute actions.
1461,Elemental Blessing: EXP,Receiving the blessing of Eureka's elementals. Elemental EXP earned through battle is increased.
1462,Out of the Action,Unable to execute actions.
1463,Elemental Blessing: Damage,Receiving the blessing of Eureka's elementals. Damage dealt is increased and restoring HP over time.
1464,Time's Up,Nearing the end of allotted exploration time in Eureka. 
1465,Soaring,"Overcome with the battle high, increasing damage dealt and potency of HP restoration actions. Effect is nullified when piloting warmachina."
1466,Stab Wound,"Wounds dealt by a piercing weapon are bleeding, causing damage over time."
1467,Yellow Paint,Carrying a pot of yellow paint.
1468,Blue Paint,Carrying a pot of light blue paint.
1469,Black Paint,Carrying a pot of black paint.
1470,Red Paint,Carrying a pot of red paint.
1471,Last Kiss,Cursed by a kiss. Unaspected damage dealt to all nearby allies when effect ends.
1472,Apathetic,Unable to use HP restoration abilities while MP slowly drains. Not that you care.
1473,Cemented,Cement is slowly covering your body. Petrification sets in when effect ends.
1474,Filthy,Earthen residue is causing damage over time.
1475,Aether Rot,Infected with an unknown pestilience. Mortal pathogen is released when effect ends.
1476,Aether Rot Immunity,Unable to be an <hex:024804F201FA03><hex:024904F201FB03>Aether Rot<hex:0249020103><hex:0248020103> carrier.
1477,Fetters,Unable to execute actions.
1478,Connectivity,The Phantom Train is slowly leeching your life essence. Damage taken is also increased.
1479,Falling,Decided absence of terra firma is causing an inability to execute certain actions.
1480,Unrelenting Anguish,Continuously launching <hex:024804F201FA03><hex:024904F201FB03>Aratama<hex:0249020103><hex:0248020103> from your body.
1481,Ominous Wind,Touched by an ominous wind. Coming in contact with another cursed by the selfsame wind causes the omen to spread.
1482,Mana Charge,Charging mana for a forthcoming spell.
1483,Fire Charged,Mana sufficient to cast <hex:024804F201F403><hex:024904F201F503>Fire III<hex:0249020103><hex:0248020103> or equivalent.
1484,Blizzard Charged,Mana sufficient to cast <hex:024804F201F403><hex:024904F201F503>Blizzard III<hex:0249020103><hex:0248020103> or equivalent.
1485,Thunder Charged,Mana sufficient to cast <hex:024804F201F403><hex:024904F201F503>Thunder III<hex:0249020103><hex:0248020103> or equivalent.
1486,Jester's Antics,"Effect radius and characteristics for <hex:024804F201F403><hex:024904F201F503>Fire<hex:0249020103><hex:0248020103>, <hex:024804F201F403><hex:024904F201F503>Ice<hex:0249020103><hex:0248020103>, and <hex:024804F201F403><hex:024904F201F503>Lightning<hex:0249020103><hex:0248020103> spells are severely altered."
1487,Jester's Truths,"Effect radius and characteristics for <hex:024804F201F403><hex:024904F201F503>Fire<hex:0249020103><hex:0248020103>, <hex:024804F201F403><hex:024904F201F503>Ice<hex:0249020103><hex:0248020103>, and <hex:024804F201F403><hex:024904F201F503>Lightning<hex:0249020103><hex:0248020103> spells are unaltered."
1488,Incurable,All HP restoration is nullified.
1489,Ultros Simulation,The Ultros simulation program is loaded.
1490,Air Force Simulation,The Air Force simulation program is loaded.
1491,Dadaluma Simulation,The Dadaluma simulation program is loaded.
1492,Bibliotaph Simulation,The Bibliotaph simulation program is loaded.
1493,Virus,A virus is loaded.
1494,Face in the Crowd,Participating in a live performance.
1495,Scalebound,You have entered the sacred domain of the Rathalos and are somehow unable to heal wounds via any method save mega potions.
1496,Vanished,Invisible to enemies and traps.
1497,Fetters,Unable to execute actions.
1498,Shocked,Experiencing periodic immobility while bleeding HP over time.
1499,Heavy Medal,"The weight of medals collected is hampering faculty to fend off attacks. The higher the stack, the more damage taken."
1500,Heavy Medal,"The weight of medals collected is hampering faculty to fend off attacks. The higher the stack, the more damage taken."
1501,Heavy Medal,"The weight of medals collected is hampering faculty to fend off attacks. The higher the stack, the more damage taken."
1502,Heavy Medal,"The weight of medals collected is hampering faculty to fend off attacks. The higher the stack, the more damage taken."
1503,Light Medal,"The lack of medals collected is increasing faculty to fend off attacks. The higher the stack, the less damage taken."
1504,Light Medal,"The lack of medals collected is increasing faculty to fend off attacks. The higher the stack, the less damage taken."
1505,Light Medal,"The lack of medals collected is increasing faculty to fend off attacks. The higher the stack, the less damage taken."
1506,Light Medal,"The lack of medals collected is increasing faculty to fend off attacks. The higher the stack, the less damage taken."
1507,Pollen,"Deadly pollen has filled the lungs, causing damage over time."
1508,Windburn,Sustaining wind damage over time.
1509,Slow,"Weaponskill cast time and recast time, spell cast time and recast time, and auto-attack delay are increased."
1510,Sleep,Overwhelming drowsiness is preventing the execution of actions.
1511,Petrification,Stone-like rigidity is preventing the execution of actions.
1512,Knockback Penalty,Unable to use knockback and draw-in effects.
1513,Stun,Unable to execute actions.
1514,スリル・オブ・ウォー：効果,連続してＨＰが回復している状態。
1515,Hover,Floating above ground.
1516,Cemented,Cement is slowly covering your body. Petrification sets in when effect ends.
1517,Fire Resistance Up,Fire resistance is increased.
1518,King of the Skies,The Rathalos has unleashed its true might.
1519,Drubbed,Taking blunt damage over time.
1520,Mounted,Riding atop a Rathalos.
1521,Stun,Unable to act and taking increased damage.
1522,Stun,Unable to act.
1523,Haste+,"Weaponskill cast time and recast time, spell cast time and recast time, and auto-attack delay are reduced. Effect cannot be nullified."
1524,Blind,Encroaching darkness is lowering accuracy.
1525,Thermal Low,The wind is high.
1526,Thermal High,The wind has died. Resistance to wind damage is increased.
1527,Accursed Flame,Sustaining fire damage over time.
1528,Aetherially Charged,Charged with aether.
1529,Woken,Overcharged with aether.
1530,Beyond Limits,Hypercharged with aether.
1531,Down the Rabbit Hole,Being guided to buried treasure.
1532,Viscous Aetheroplasm,Aetheroplasm is attached to your body. A stack of 5 will result in instant death.
1533,Airbound,Unable to move.
1534,Role-playing,Experiencing what it is to be someone else.
1535,Full Moon,Unleashing the power of the full moon.
1536,New Moon,Unleashing the power of the new moon.
1537,Blood Moon,Bringing to bear the full might of the dark and bright blades.
1538,Moonlit,Under the influence of the full moon.
1539,Moonshadowed,Under the influence of the new moon.
1540,Veil of Shadow,Darkness shields you from the full moon's influence.
1541,Veil of Light,Light shields you from the new moon's influence.
1542,Haunt,Memory is taking corporeal form.
1543,Haunt,Memory is taking corporeal form.
1544,Damage Up,Damage dealt is increased.
1545,Vulnerability Down,Damage taken is reduced.
1546,Odder,Transformed into an otter and unable to execute actions.
1547,Indomitable Spirit,"Maximum HP, damage dealt, and potency of HP restoration actions are increased."
1548,Sprint,Movement speed is increased.
1549,Unmagicked,Unable to use magicite.
1550,Magnetic Lysis +,Body is exhibiting a positive magnetic charge.
1551,Magnetic Lysis -,Body is exhibiting a negative magnetic charge.
1552,Magnetic Levitation,Suspended in midair.
1553,The One Dragon,Yiazmat's body is pulsing with power.
1554,Borne Heart,Yiazmat's heart is exposed and can be broken.
1555,Heartless,Yiazmat's heart is destroyed. Maximum HP is decreased.
1556,Threatened,Maximum HP is decreased.
1557,HP Penalty,Maximum HP is severely decreased.
1558,HP Boost +1,Maximum HP is increased by 1.
1559,HP Boost +2,Maximum HP is increased by 2.
1560,HP Boost +3,Maximum HP is increased by 3.
1561,HP Boost +4,Maximum HP is increased by 4.
1562,Computation Mode,Basic computation protocol is loaded.
1563,Tartarus Mode,Tartarean protocol is loaded.
1564,Annihilation Mode,Annihilation protocol is loaded.
1565,Computation Boost,Damage dealt is increased.
1566,Computation Error,Damage taken is increased.
1567,Primal Rage,Invulnerable to all damage.
1568,Slow+,"Weaponskill cast time and recast time, spell cast time and recast time, and auto-attack delay are increased. Effect cannot be nullified."
1569,Auspicious,Temporarily granted the power of an auspice.
1570,Invincibility,Invulnerable to all damage.
1571,Temporal Barrier,The effect of <hex:024804F201FA03><hex:024904F201FB03>Temporal Stasis<hex:0249020103><hex:0248020103> is nullified.
1572,Damage Up,Damage dealt is increased.
1573,Grudge,Damage taken is turning to resentment.
1574,,
1575,Brotherly Love,Bound by fraternal bonds.
1576,石化の呪い,石化した状態。攻撃を受けると戦闘不能になる。
1577,Burns,Sustaining fire damage over time.
1578,Searing Wind,Ignited by white-hot embers and scorching those nearby. Sustaining fire damage over time.
1579,Thin Ice,Having trouble maintaining a solid foothold upon ice-covered ground.
1580,Thin Ice,Having trouble maintaining a solid foothold upon ice-covered ground.
1581,Adaptation,Adapted to an aetherially unstable environment.
1582,Mutation,Aetherial instability is triggering mutations.
1583,Elemental EXP Up,Elemental EXP earned through battle while at an elemental level lower than 20 is increased.
1584,Komainu's Favor,Damage dealt is increased.
1585,Inugami's Favor,Damage taken is decreased.
1586,Senri's Favor,Regenerating HP over time.
1587,Elemental Harmony,Elemental EXP earned through battle is increased.
1588,Mutation,Aetherial instability is triggering mutations.
1589,Mutation,Aetherial instability is triggering mutations.
1590,Light in the Dark,Absorbing the light of a deepvoid torch and transforming it into mana.
1591,Woken,Overcharged with aether.
1592,Damage Up,Damage dealt is increased.
1593,Adaptation,Adapted to an aetherially unstable environment.
1594,Hundred Fists,"Weaponskill cast time and recast time, spell cast time and recast time, and auto-attack delay are reduced."
1595,Heavy,Movement speed is reduced.
1596,Sleep,Overwhelming drowsiness is preventing the execution of actions.
1597,Vulnerability Up,Damage taken is increased.
1598,Mutation,Aetherial instability is triggering mutations.
1599,Pyretic,Fire-aspected damage is taken with every action.
1600,Entropy,Plagued by chaotic flames that will deal damage to nearby party members when the effect ends.
1601,Dynamic Fluid,Plagued by a chaotic body of water that will deal damage when the effect ends.
1602,Headwind,"Plagued by chaotic frontal winds that will deal damage when the effect ends. Effect dissipates upon exposure to directional winds. Knockback effects from winds faced head-on are doubled, while those of rear winds are reduced by half."
1603,Tailwind,"Plagued by chaotic rear winds that will deal damage when the effect ends. Effect dissipates upon exposure to directional winds. Knockback effects from winds faced head-on are reduced by half, while those of rear winds are doubled."
1604,Accretion,Plagued by rapidly hardening mud. All HP recovery is reduced. Effect dissipates once fully healed.
1605,Primordial Crust,"Plagued by rapidly hardening mud. Damage taken is reduced, but all HP recovery is nullified. Effect dissipates when damage that would cause HP to drop below 0 is taken, leaving HP at 1."
1606,Muddy,In need of a good rinsing. Damage taken is reduced.
1607,●弱点：雷属性,●強烈な雷属性が有効。
1608,Transfiguration,Corporeal form has been altered.
1609,Transfiguration,Corporeal form has been altered.
1610,Landborne,Drawing power from the land itself.
1611,Arcane Bulwark,Protected by a magicked barrier.
1612,Defenseless,Unable to call upon the arcane bulwark for protection.
1613,Burning Soul,The immortal spirit blazes bright within.
1614,Fetters,Unable to execute actions.
1615,Crumbling Bulwark,Magicked barrier is gradually disintegrating.
1616,Death from Above,Any auto-attack from a skyborne opponent will apply <hex:024804F201FA03><hex:024904F201FB03>Doom<hex:0249020103><hex:0248020103>.
1617,Death from Below,Any auto-attack from a landborne opponent will apply <hex:024804F201FA03><hex:024904F201FB03>Doom<hex:0249020103><hex:0248020103>.
1618,Logos-minded,Ruminating on extracted mnemes. Ready to use select logos actions.
1619,Preoccupied,Engaged in complex maneuvers.
1620,Unveiled,Gilgamesh's true form is revealed.
1621,Concealed,Unable to be detected from a distance.
1622,Critical Strikes,All attacks are dealing critical damage.
1623,Live Wire,Crackling like a levinbolt. Damage dealt against opponents vulnerable to electricity is increased.
1624,Looper,Corrupted by Omega's program loop.
1625,Memory Degradation,Gradually forgetting important details. A stack of 6 will result in full memory loss.
1626,Memory Loss,Bereft of sense of self and purpose.
1627,Chains of Memory,Under siege by what you can no longer remember.
1628,Gradual Petrification,Flesh once soft is slowly turning to stone. Effect dissipates once fully healed.
1629,Kill Command,Deleting variables from the Interdimensional Rift.
1630,Love's True Form,Suzaku's heretofore unknown visage is revealed.
1631,Wisdom of the Aetherweaver,Magic damage is increased.
1632,Wisdom of the Martialist,Damage dealt is increased.
1633,Wisdom of the Platebearer,Maximum HP is increased while damage taken is reduced.
1634,Wisdom of the Guardian,Maximum HP is increased while damage taken is reduced.
1635,Wisdom of the Ordained,Maximum MP and healing magic potency are increased.
1636,Wisdom of the Skirmisher,Damage dealt is increased.
1637,Wisdom of the Watcher,"Evasion is enhanced, while damage dealt is reduced."
1638,Wisdom of the Templar,"Maximum HP and healing magic potency are increased, while damage dealt is reduced."
1639,Wisdom of the Irregular,"Damage dealt is increased, while magic defense is reduced."
1640,Wisdom of the Breathtaker,"Movement speed, evasion, and poison resistance are increased."
1641,Spirit of the Remembered,Maximum HP and accuracy are increased. Chance of automatic revival upon KO.
1642,Protect L,Physical damage taken is reduced.
1643,Shell L,Magic damage taken is reduced.
1644,Swift L,Movement speed is increased.
1645,Rapid Recast,Recast time of next ability is reduced.
1646,Bravery L,Damage dealt is increased.
1647,Solid Shield,Physical damage taken is reduced.
1648,Spell Shield,Magic damage taken is reduced.
1649,Reflect L,Reflecting magic back on its caster.
1650,Poison L,Toxins are causing damage over time.
1651,Refresh L,Magia aether regeneration is increased.
1652,Magic Burst,Damage dealt by spells and MP cost of spells is increased.
1653,Double Edge L,"Physical damage dealt is increasing, while you are sustaining damage over time."
1654,Spirit Dart L,Damage taken is increased.
1655,Banish L,Damage taken is increased.
1656,Boost,Attack power of next weaponskill is increased.
1657,Incense L,Enmity is increased.
1658,Omega,Inscrutable.
1659,Infinite Limit,Actions transcending standard limits.
1660,Packet Filter M,Firewall is preventing the dealing of damage to Omega-M.
1661,Packet Filter F,Firewall is preventing the dealing of damage to Omega-F.
1662,Local Resonance,Combat capabilities increase with proximity to counterpart.
1663,Remote Resonance,Combat capabilities increase with distance from counterpart.
1664,Critical Synchronization Bug,Affected by a critical error. Data corruption will cause damage and spread when the effect ends.
1665,Critical Overflow Bug,Affected by a critical error. Data corruption will cause damage and spread when the effect ends.
1666,Critical Underflow Bug,Affected by a critical error. Coming in contact with allies will cause data corruption to spread. Corruption will cause damage when the effect ends.
1667,Synchronization Debugger,Invulnerable to synchronization bugs.
1668,Overflow Debugger,Invulnerable to overflow bugs.
1669,Underflow Debugger,Invulnerable to underflow bugs.
1670,Latent Defect,Affected by a hidden error that will cause damage when the effect ends. Effect canceled upon being hit by a certain action.
1671,Cascading Latent Defect,Affected by a hidden error that will cause damage when the effect ends. Effect canceled upon being hit by a certain action.
1672,Local Regression,"Affected by a patch error. Data corruption will cause damage when in close proximity to others affected by the same error, or when the effect ends."
1673,Remote Regression,"Affected by a patch error. Data corruption will cause damage when out of range of others affected by the same error, or when the effect ends."
1674,Omega-M,Mimicking the male form.
1675,Omega-F,Mimicking the female form.
1676,Superfluid,In a transitional liquid state.
1677,Bloodbath L,Attacks generate HP equal to a portion of damage dealt.
1678,,
1679,Spell-in-Waiting: Return IV,"Designated target of <hex:024804F201F403><hex:024904F201F503>Return IV<hex:0249020103><hex:0248020103>, which will activate when this effect expires."
